{
    "id": "led-controller",
    "title": "LED Controller",
    "intro" : "This is a simple LED controller that allows you to turn on and off an LED with a button.",
    "difficulty": "easy",
    "components":[
        {
            "name": "LED"
        }
    ],
    "story": "Sie k√∂nnen eine Verbindung vom GPIO 23 des ESP32 zu einer beliebigen LED herstellen. Die LED wird mit der Funktion 'ledcWrite' angesteuert. Der PWM-Wert, der die Helligkeit der LED steuert. Der Wert reicht von 0 (aus) bis 255 (maximale Helligkeit). Diese Funktion steuert die Helligkeit der LED, indem sie einen PWM-Wert (Pulsweitenmodulation) auf den angegebenen Kanal schreibt. Ein Beispiel: 'ledcWrite(0, 128)' setzt die Helligkeit der LED auf 50%. Flashen Sie die Solution auf den ESP32 und sehen Sie, wie die LED mit dem Schieberegler gesteuert wird.",
    "user_input": {
        "buttons": [
            {
            "label": "ON/OFF Switch",
            "topic": "led-button"
            }
        ],
        "sliders": [
            {
            "label" : "Brightness",
            "topic": "led-brightness"
            }
        ],
        "graphs": [
         ]
         ,
         "displays": [
 
         ]
    },
    "solution": {
        "explanation": "The LED controller uses a button to turn the LED on and off. When the button is pressed, the LED turns on. When the button is released, the LED turns off. The button is connected to a digital pin on the microcontroller. The LED is connected to another digital pin. When the button is pressed, the microcontroller reads a HIGH signal from the button pin and turns the LED on. When the button is released, the microcontroller reads a LOW signal from the button pin and turns the LED off.",
        "code": "led-controlling.cpp"
        
    }
}